{
    "$schema": "https://json-schema.org/draft/2020-12/schema",
    "$id": "https://onidesk.com/schemas/beaver-plugin.json",
    "title": "Beaver Plugin Manifest",
    "type": "object",
    "required": [
        "name",
        "slug",
        "version",
        "namespace",
        "main",
        "beaver_version"
    ],
    "additionalProperties": false,
    "properties": {
        "name": {
            "type": "string",
            "minLength": 2,
            "maxLength": 60
        },
        "slug": {
            "type": "string",
            "pattern": "^[a-z][a-z0-9_-]*$"
        },
        "version": {
            "type": "string",
            "pattern": "^\\d+\\.\\d+\\.\\d+$"
        },
        "author": {
            "type": "string"
        },
        "description": {
            "type": "string",
            "maxLength": 200
        },
        "namespace": {
            "type": "string",
            "pattern": "^[A-Z][A-Za-z0-9_\\\\]+$"
        },
        "main": {
            "type": "string",
            "pattern": "\\.php$"
        },
        "beaver_version": {
            "type": "string"
        },
        "api_version": {
            "type": "string",
            "default": "1.0.0"
        },
        "requires": {
            "type": "object",
            "properties": {
                "php": {
                    "type": "string"
                },
                "ext": {
                    "type": "array",
                    "items": {
                        "type": "string"
                    }
                },
                "plugins": {
                    "type": "array",
                    "items": {
                        "type": "string"
                    }
                }
            }
        },
        "permissions": {
            "type": "array",
            "items": {
                "type": "string",
                "enum": [
                    "db.read",
                    "db.write",
                    "http.outbound",
                    "fs.read",
                    "fs.write",
                    "hooks.listen",
                    "hooks.emit",
                    "routes.register",
                    "views.register",
                    "migrations.run",
                    "settings.manage"
                ]
            }
        },
        "admin_menu": {
            "type": "object",
            "properties": {
                "label": {
                    "type": "string"
                },
                "icon": {
                    "type": "string"
                },
                "order": {
                    "type": "integer"
                }
            }
        },
        "routes": {
            "type": "string"
        }
    }
}
